{
  "schema": "materials-simulation-skills.index.v1",
  "repository": "HeshamFS/materials-simulation-skills",
  "summary": {
    "skills": 24,
    "scripts": 78,
    "eval_cases": 115,
    "deterministic_checks": 131,
    "eval_coverage": 1.0,
    "categories": [
      "core-numerical",
      "data-management",
      "hpc-deployment",
      "meta",
      "ontology",
      "robustness",
      "simulation-workflow",
      "verification-validation"
    ]
  },
  "skills": [
    {
      "name": "convergence-study",
      "category": "core-numerical",
      "path": "skills/core-numerical/convergence-study",
      "description": "Perform spatial and temporal convergence analysis for solution verification — compute observed convergence orders from grid or timestep refinement studies, apply Richardson extrapolation to estimate discretization error, and calculate the Grid Convergence Index (GCI) per ASME V&V 20 standards. Use when verifying that a numerical solution converges at the expected rate, estimating the error on the finest mesh, checking whether grids are in the asymptotic range, or preparing formal verification reports, even if the user only asks \"is my mesh fine enough\" or \"how accurate is my solution.\"",
      "version": "1.2.3",
      "security_tier": "high",
      "allowed_tools": [],
      "scripts": 4,
      "eval_cases": 8,
      "deterministic_checks": 8,
      "eval_coverage": 1.0,
      "last_evaluated": "2026-06-24",
      "last_deterministic_eval": "2026-10-20",
      "agent_evaluation_status": "not_revalidated",
      "standards": [
        "ASME V&V 20 (Standard for Verification and Validation in Computational Fluid Dynamics and Heat Transfer)",
        "Roache, Grid Convergence Index (GCI) method with safety factors Fs in {1.25, 3.0}",
        "Richardson extrapolation for discretization error estimation",
        "Method of Manufactured Solutions (MMS) for code verification",
        "AIAA verification and validation guidelines"
      ]
    },
    {
      "name": "differentiation-schemes",
      "category": "core-numerical",
      "path": "skills/core-numerical/differentiation-schemes",
      "description": "Select and apply numerical differentiation schemes for PDE and ODE discretization — generate finite-difference stencils at arbitrary order and accuracy, choose between central, upwind, compact (Pade), and spectral methods, handle boundary stencils, and estimate truncation error scaling. Use when discretizing spatial derivatives, picking a scheme for advection- or diffusion-dominated problems, building custom stencils for nonstandard operators, or comparing dispersion and dissipation properties of candidate schemes, even if the user just says \"how do I approximate this derivative\" or \"my solution is too diffusive.\"",
      "version": "1.2.2",
      "security_tier": "high",
      "allowed_tools": [
        "Read",
        "Bash",
        "Write",
        "Grep",
        "Glob"
      ],
      "scripts": 3,
      "eval_cases": 4,
      "deterministic_checks": 4,
      "eval_coverage": 1.0,
      "last_evaluated": "2026-06-24",
      "last_deterministic_eval": "2026-10-20",
      "agent_evaluation_status": "not_revalidated",
      "standards": [
        "Fornberg (1988), Generation of finite difference formulas on arbitrarily spaced grids",
        "Taylor-series truncation-error analysis / order-of-accuracy theory",
        "Lele (1992), Compact finite difference schemes with spectral-like resolution",
        "Richardson extrapolation and grid-convergence (observed-order) verification",
        "Jiang & Shu (1996), ENO/WENO essentially non-oscillatory schemes"
      ]
    },
    {
      "name": "linear-solvers",
      "category": "core-numerical",
      "path": "skills/core-numerical/linear-solvers",
      "description": "Select and configure linear solvers for Ax=b systems arising in numerical simulations — choose between direct (LU, Cholesky) and iterative (CG, GMRES, BiCGSTAB, MINRES) methods, analyze sparsity patterns and matrix conditioning, recommend preconditioners (AMG, ILU, IC), apply row/column scaling, and diagnose convergence stagnation from residual histories. Use when setting up a linear solve for FEM/FVM assembly, debugging slow or stalled Krylov iterations, choosing a preconditioner for SPD or nonsymmetric systems, or investigating ill-conditioning, even if the user only says \"my solver is slow\" or \"GMRES won't converge.\"",
      "version": "1.2.3",
      "security_tier": "medium",
      "allowed_tools": [
        "Read",
        "Write",
        "Grep",
        "Glob"
      ],
      "scripts": 6,
      "eval_cases": 4,
      "deterministic_checks": 7,
      "eval_coverage": 1.0,
      "last_evaluated": "2026-06-24",
      "last_deterministic_eval": "2026-10-20",
      "agent_evaluation_status": "not_revalidated",
      "standards": [
        "Saad (2003), Iterative Methods for Sparse Linear Systems (Krylov methods, ILU/ILUT, preconditioning)",
        "Hestenes & Stiefel (1952) Conjugate Gradient method and the (√κ−1)/(√κ+1) error bound",
        "Saad & Schultz (1986), GMRES restarted Krylov method",
        "Ruge & Stüben (1987), Algebraic Multigrid (AMG) classical coarsening",
        "Ruiz (2001) equilibration; Sinkhorn & Knopp (1967) doubly-stochastic scaling"
      ]
    },
    {
      "name": "mesh-generation",
      "category": "core-numerical",
      "path": "skills/core-numerical/mesh-generation",
      "description": "Plan and evaluate mesh generation for numerical simulations — estimate grid resolution from physics scales (interface width, boundary layers, wavelengths), check aspect ratios and skewness against quality thresholds, choose between structured, unstructured, and adaptive mesh refinement strategies, and compute grid sizing for 1D/2D/3D domains. Use when setting up a new mesh, diagnosing poor solver convergence caused by mesh quality, deciding how many points to place across a phase-field interface or boundary layer, or preparing a mesh convergence study, even if the user only asks \"what resolution do I need\" or \"why is my solver failing.\"",
      "version": "1.2.2",
      "security_tier": "medium",
      "allowed_tools": [
        "Read",
        "Write",
        "Grep",
        "Glob"
      ],
      "scripts": 2,
      "eval_cases": 4,
      "deterministic_checks": 5,
      "eval_coverage": 1.0,
      "last_evaluated": "2026-06-24",
      "last_deterministic_eval": "2026-10-20",
      "agent_evaluation_status": "not_revalidated",
      "standards": [
        "ANSYS Fluent/ICEM equiangle skewness metric (max(|90-theta|)/90 for quads/hexes; (theta_max-60)/120 for triangles)",
        "Knupp (2001), Algebraic mesh quality metrics (aspect ratio, Jacobian ratio, warpage)",
        "Shewchuk (2002), What Is a Good Linear Finite Element? (triangle radius-ratio and minimum-angle quality, Delaunay)",
        "Jasak (1996) / OpenFOAM finite-volume non-orthogonality correction",
        "Roache (1998), Verification and Validation in Computational Science (grid/mesh convergence study)"
      ]
    },
    {
      "name": "nonlinear-solvers",
      "category": "core-numerical",
      "path": "skills/core-numerical/nonlinear-solvers",
      "description": "Select and configure nonlinear solvers for root-finding f(x)=0, optimization min F(x), and least-squares problems — choose among Newton, Newton-Krylov, quasi-Newton (BFGS, L-BFGS), Broyden, Anderson acceleration, and Levenberg-Marquardt methods, configure line search or trust-region globalization, diagnose convergence rate (quadratic, linear, stagnated), and assess Jacobian quality and conditioning. Use when a Newton solver converges slowly or diverges, choosing between line search and trust region, debugging nonlinear iteration failures in FEM or phase-field codes, or selecting a solver for large-scale unconstrained optimization, even if the user only says \"my Newton iterations aren't converging.\"",
      "version": "1.2.3",
      "security_tier": "high",
      "allowed_tools": [
        "Read",
        "Bash",
        "Write",
        "Grep",
        "Glob"
      ],
      "scripts": 6,
      "eval_cases": 5,
      "deterministic_checks": 7,
      "eval_coverage": 1.0,
      "last_evaluated": "2026-06-24",
      "last_deterministic_eval": "2026-10-20",
      "agent_evaluation_status": "not_revalidated",
      "standards": [
        "Nocedal & Wright (2006), Numerical Optimization (BFGS/L-BFGS, trust region, dogleg, Steihaug-CG, Wolfe conditions)",
        "Dennis & Schnabel (1996), Numerical Methods for Unconstrained Optimization and Nonlinear Equations (Newton, Broyden good/bad, line-search globalization)",
        "Kelley (1995), Iterative Methods for Linear and Nonlinear Equations (inexact Newton, Newton-Krylov); Eisenstat & Walker (1996) forcing sequence",
        "Walker & Ni (2011), Anderson acceleration for fixed-point iterations (Anderson 1965)",
        "Levenberg (1944) / Marquardt (1963), Levenberg-Marquardt method for nonlinear least-squares"
      ]
    },
    {
      "name": "numerical-integration",
      "category": "core-numerical",
      "path": "skills/core-numerical/numerical-integration",
      "description": "Select and configure time integration methods for ODE and PDE simulations — choose among explicit Runge-Kutta, BDF, Rosenbrock, and Adams families, set relative and absolute error tolerances, implement adaptive step-size control with P/PI step-size controllers, plan IMEX operator splitting for mixed stiff and non-stiff terms, and estimate splitting errors. Use when picking an integrator for a new simulation, diagnosing step rejections or tolerance failures, setting up operator splitting for phase-field or reaction-diffusion problems, or deciding between explicit and implicit time marching, even if the user only says \"my solver keeps rejecting steps\" or \"which ODE method should I use.\"",
      "version": "1.2.3",
      "security_tier": "medium",